2025-01-18 00:54:45,726 ----------------------------------------------------------------------------------------------------
2025-01-18 00:54:45,727 Model: "TARSClassifier(
  (tars_model): TextClassifier(
    (embeddings): TransformerDocumentEmbeddings(
      (model): BertModel(
        (embeddings): BertEmbeddings(
          (word_embeddings): Embedding(30523, 768, padding_idx=0)
          (position_embeddings): Embedding(512, 768)
          (token_type_embeddings): Embedding(2, 768)
          (LayerNorm): LayerNorm((768,), eps=1e-12, elementwise_affine=True)
          (dropout): Dropout(p=0.1, inplace=False)
        )
        (encoder): BertEncoder(
          (layer): ModuleList(
            (0-11): 12 x BertLayer(
              (attention): BertAttention(
                (self): BertSdpaSelfAttention(
                  (query): Linear(in_features=768, out_features=768, bias=True)
                  (key): Linear(in_features=768, out_features=768, bias=True)
                  (value): Linear(in_features=768, out_features=768, bias=True)
                  (dropout): Dropout(p=0.1, inplace=False)
                )
                (output): BertSelfOutput(
                  (dense): Linear(in_features=768, out_features=768, bias=True)
                  (LayerNorm): LayerNorm((768,), eps=1e-12, elementwise_affine=True)
                  (dropout): Dropout(p=0.1, inplace=False)
                )
              )
              (intermediate): BertIntermediate(
                (dense): Linear(in_features=768, out_features=3072, bias=True)
                (intermediate_act_fn): GELUActivation()
              )
              (output): BertOutput(
                (dense): Linear(in_features=3072, out_features=768, bias=True)
                (LayerNorm): LayerNorm((768,), eps=1e-12, elementwise_affine=True)
                (dropout): Dropout(p=0.1, inplace=False)
              )
            )
          )
        )
        (pooler): BertPooler(
          (dense): Linear(in_features=768, out_features=768, bias=True)
          (activation): Tanh()
        )
      )
    )
    (decoder): Linear(in_features=768, out_features=2, bias=True)
    (dropout): Dropout(p=0.0, inplace=False)
    (locked_dropout): LockedDropout(p=0.0)
    (word_dropout): WordDropout(p=0.0)
    (loss_function): CrossEntropyLoss()
  )
  (_current_task): SentenceTransformer(
    (0): Transformer({'max_seq_length': 512, 'do_lower_case': False}) with Transformer model: BertModel 
    (1): Pooling({'word_embedding_dimension': 768, 'pooling_mode_cls_token': False, 'pooling_mode_mean_tokens': True, 'pooling_mode_max_tokens': False, 'pooling_mode_mean_sqrt_len_tokens': False, 'pooling_mode_weightedmean_tokens': False, 'pooling_mode_lasttoken': False, 'include_prompt': True})
  )
)"
2025-01-18 00:54:45,727 ----------------------------------------------------------------------------------------------------
2025-01-18 00:54:45,727 Corpus: 1 train + 1 dev + 1 test sentences
2025-01-18 00:54:45,727 ----------------------------------------------------------------------------------------------------
2025-01-18 00:54:45,727 Train:  1 sentences
2025-01-18 00:54:45,727         (train_with_dev=False, train_with_test=False)
2025-01-18 00:54:45,727 ----------------------------------------------------------------------------------------------------
2025-01-18 00:54:45,727 Training Params:
2025-01-18 00:54:45,727  - learning_rate: "0.1" 
2025-01-18 00:54:45,727  - mini_batch_size: "32"
2025-01-18 00:54:45,727  - max_epochs: "64"
2025-01-18 00:54:45,727  - shuffle: "True"
2025-01-18 00:54:45,727 ----------------------------------------------------------------------------------------------------
2025-01-18 00:54:45,727 Plugins:
2025-01-18 00:54:45,727  - AnnealOnPlateau | patience: '3', anneal_factor: '0.5', min_learning_rate: '0.0001'
2025-01-18 00:54:45,727 ----------------------------------------------------------------------------------------------------
2025-01-18 00:54:45,727 Final evaluation on model from best epoch (best-model.pt)
2025-01-18 00:54:45,727  - metric: "('micro avg', 'f1-score')"
2025-01-18 00:54:45,727 ----------------------------------------------------------------------------------------------------
2025-01-18 00:54:45,727 Computation:
2025-01-18 00:54:45,727  - compute on device: cuda:0
2025-01-18 00:54:45,727  - embedding storage: cpu
2025-01-18 00:54:45,727 ----------------------------------------------------------------------------------------------------
2025-01-18 00:54:45,727 Model training base path: "."
2025-01-18 00:54:45,727 ----------------------------------------------------------------------------------------------------
2025-01-18 00:54:45,727 ----------------------------------------------------------------------------------------------------
2025-01-18 00:54:46,234 epoch 1 - iter 1/1 - loss 0.61486476 - time (sec): 0.25 - samples/sec: 27.74 - lr: 0.100000 - momentum: 0.000000
2025-01-18 00:54:46,235 ----------------------------------------------------------------------------------------------------
2025-01-18 00:54:46,235 EPOCH 1 done: loss 0.6149 - lr: 0.100000
2025-01-18 00:54:46,291 DEV : loss 1.1716500921465922e-05 - f1-score (micro avg)  0.0
2025-01-18 00:54:46,291  - 0 epochs without improvement
2025-01-18 00:54:46,291 ----------------------------------------------------------------------------------------------------
2025-01-18 00:54:46,383 epoch 2 - iter 1/1 - loss 0.00001650 - time (sec): 0.09 - samples/sec: 80.61 - lr: 0.100000 - momentum: 0.000000
2025-01-18 00:54:46,383 ----------------------------------------------------------------------------------------------------
2025-01-18 00:54:46,383 EPOCH 2 done: loss 0.0000 - lr: 0.100000
2025-01-18 00:54:46,506 DEV : loss 1.07287787614041e-05 - f1-score (micro avg)  0.0
2025-01-18 00:54:46,506  - 0 epochs without improvement
2025-01-18 00:54:46,506 ----------------------------------------------------------------------------------------------------
2025-01-18 00:54:46,597 epoch 3 - iter 1/1 - loss 0.00002301 - time (sec): 0.09 - samples/sec: 81.05 - lr: 0.100000 - momentum: 0.000000
2025-01-18 00:54:46,597 ----------------------------------------------------------------------------------------------------
2025-01-18 00:54:46,597 EPOCH 3 done: loss 0.0000 - lr: 0.100000
2025-01-18 00:54:46,725 DEV : loss 9.519668310531415e-06 - f1-score (micro avg)  0.0
2025-01-18 00:54:46,725  - 0 epochs without improvement
2025-01-18 00:54:46,725 ----------------------------------------------------------------------------------------------------
2025-01-18 00:54:46,816 epoch 4 - iter 1/1 - loss 0.00002245 - time (sec): 0.09 - samples/sec: 80.75 - lr: 0.100000 - momentum: 0.000000
2025-01-18 00:54:46,817 ----------------------------------------------------------------------------------------------------
2025-01-18 00:54:46,817 EPOCH 4 done: loss 0.0000 - lr: 0.100000
2025-01-18 00:54:46,939 DEV : loss 8.480854376102798e-06 - f1-score (micro avg)  0.0
2025-01-18 00:54:46,939  - 0 epochs without improvement
2025-01-18 00:54:46,939 ----------------------------------------------------------------------------------------------------
2025-01-18 00:54:47,030 epoch 5 - iter 1/1 - loss 0.00001170 - time (sec): 0.09 - samples/sec: 81.41 - lr: 0.100000 - momentum: 0.000000
2025-01-18 00:54:47,030 ----------------------------------------------------------------------------------------------------
2025-01-18 00:54:47,030 EPOCH 5 done: loss 0.0000 - lr: 0.100000
2025-01-18 00:54:47,154 DEV : loss 7.935901521705091e-06 - f1-score (micro avg)  0.0
2025-01-18 00:54:47,154  - 0 epochs without improvement
2025-01-18 00:54:47,154 ----------------------------------------------------------------------------------------------------
2025-01-18 00:54:47,246 epoch 6 - iter 1/1 - loss 0.00001422 - time (sec): 0.09 - samples/sec: 80.64 - lr: 0.100000 - momentum: 0.000000
2025-01-18 00:54:47,246 ----------------------------------------------------------------------------------------------------
2025-01-18 00:54:47,246 EPOCH 6 done: loss 0.0000 - lr: 0.100000
2025-01-18 00:54:47,372 DEV : loss 7.339859621424694e-06 - f1-score (micro avg)  0.0
2025-01-18 00:54:47,372  - 0 epochs without improvement
2025-01-18 00:54:47,372 ----------------------------------------------------------------------------------------------------
2025-01-18 00:54:47,462 epoch 7 - iter 1/1 - loss 0.00001536 - time (sec): 0.09 - samples/sec: 82.02 - lr: 0.100000 - momentum: 0.000000
2025-01-18 00:54:47,462 ----------------------------------------------------------------------------------------------------
2025-01-18 00:54:47,462 EPOCH 7 done: loss 0.0000 - lr: 0.100000
2025-01-18 00:54:47,585 DEV : loss 6.743817721144296e-06 - f1-score (micro avg)  0.0
2025-01-18 00:54:47,585  - 0 epochs without improvement
2025-01-18 00:54:47,585 ----------------------------------------------------------------------------------------------------
2025-01-18 00:54:47,752 epoch 8 - iter 1/1 - loss 0.00001197 - time (sec): 0.16 - samples/sec: 43.20 - lr: 0.100000 - momentum: 0.000000
2025-01-18 00:54:47,752 ----------------------------------------------------------------------------------------------------
2025-01-18 00:54:47,752 EPOCH 8 done: loss 0.0000 - lr: 0.100000
2025-01-18 00:54:47,875 DEV : loss 6.352132004394662e-06 - f1-score (micro avg)  0.0
2025-01-18 00:54:47,875  - 0 epochs without improvement
2025-01-18 00:54:47,875 ----------------------------------------------------------------------------------------------------
2025-01-18 00:54:47,964 epoch 9 - iter 1/1 - loss 0.00001092 - time (sec): 0.08 - samples/sec: 82.62 - lr: 0.100000 - momentum: 0.000000
2025-01-18 00:54:47,964 ----------------------------------------------------------------------------------------------------
2025-01-18 00:54:47,964 EPOCH 9 done: loss 0.0000 - lr: 0.100000
2025-01-18 00:54:48,087 DEV : loss 5.960446742392378e-06 - f1-score (micro avg)  0.0
2025-01-18 00:54:48,088  - 0 epochs without improvement
2025-01-18 00:54:48,088 ----------------------------------------------------------------------------------------------------
2025-01-18 00:54:48,177 epoch 10 - iter 1/1 - loss 0.00001063 - time (sec): 0.08 - samples/sec: 83.11 - lr: 0.100000 - momentum: 0.000000
2025-01-18 00:54:48,177 ----------------------------------------------------------------------------------------------------
2025-01-18 00:54:48,177 EPOCH 10 done: loss 0.0000 - lr: 0.100000
2025-01-18 00:54:48,301 DEV : loss 5.568761480390094e-06 - f1-score (micro avg)  0.0
2025-01-18 00:54:48,301  - 0 epochs without improvement
2025-01-18 00:54:48,301 ----------------------------------------------------------------------------------------------------
2025-01-18 00:54:48,390 epoch 11 - iter 1/1 - loss 0.00001073 - time (sec): 0.08 - samples/sec: 83.12 - lr: 0.100000 - momentum: 0.000000
2025-01-18 00:54:48,390 ----------------------------------------------------------------------------------------------------
2025-01-18 00:54:48,390 EPOCH 11 done: loss 0.0000 - lr: 0.100000
2025-01-18 00:54:48,513 DEV : loss 5.245195552561199e-06 - f1-score (micro avg)  0.0
2025-01-18 00:54:48,513  - 0 epochs without improvement
2025-01-18 00:54:48,513 ----------------------------------------------------------------------------------------------------
2025-01-18 00:54:48,603 epoch 12 - iter 1/1 - loss 0.00000671 - time (sec): 0.08 - samples/sec: 82.41 - lr: 0.100000 - momentum: 0.000000
2025-01-18 00:54:48,603 ----------------------------------------------------------------------------------------------------
2025-01-18 00:54:48,603 EPOCH 12 done: loss 0.0000 - lr: 0.100000
2025-01-18 00:54:48,727 DEV : loss 5.057866928837029e-06 - f1-score (micro avg)  0.0
2025-01-18 00:54:48,727  - 0 epochs without improvement
2025-01-18 00:54:48,727 ----------------------------------------------------------------------------------------------------
2025-01-18 00:54:48,817 epoch 13 - iter 1/1 - loss 0.00000690 - time (sec): 0.09 - samples/sec: 82.10 - lr: 0.100000 - momentum: 0.000000
2025-01-18 00:54:48,817 ----------------------------------------------------------------------------------------------------
2025-01-18 00:54:48,817 EPOCH 13 done: loss 0.0000 - lr: 0.100000
2025-01-18 00:54:48,939 DEV : loss 4.853509835811565e-06 - f1-score (micro avg)  0.0
2025-01-18 00:54:48,940  - 0 epochs without improvement
2025-01-18 00:54:48,940 ----------------------------------------------------------------------------------------------------
2025-01-18 00:54:49,030 epoch 14 - iter 1/1 - loss 0.00001150 - time (sec): 0.09 - samples/sec: 81.71 - lr: 0.100000 - momentum: 0.000000
2025-01-18 00:54:49,030 ----------------------------------------------------------------------------------------------------
2025-01-18 00:54:49,030 EPOCH 14 done: loss 0.0000 - lr: 0.100000
2025-01-18 00:54:49,153 DEV : loss 4.546972832031315e-06 - f1-score (micro avg)  0.0
2025-01-18 00:54:49,153  - 0 epochs without improvement
2025-01-18 00:54:49,153 ----------------------------------------------------------------------------------------------------
2025-01-18 00:54:49,243 epoch 15 - iter 1/1 - loss 0.00001192 - time (sec): 0.09 - samples/sec: 82.16 - lr: 0.100000 - momentum: 0.000000
2025-01-18 00:54:49,243 ----------------------------------------------------------------------------------------------------
2025-01-18 00:54:49,243 EPOCH 15 done: loss 0.0000 - lr: 0.100000
2025-01-18 00:54:49,365 DEV : loss 4.240435828251066e-06 - f1-score (micro avg)  0.0
2025-01-18 00:54:49,365  - 0 epochs without improvement
2025-01-18 00:54:49,365 ----------------------------------------------------------------------------------------------------
2025-01-18 00:54:49,455 epoch 16 - iter 1/1 - loss 0.00001066 - time (sec): 0.09 - samples/sec: 82.00 - lr: 0.100000 - momentum: 0.000000
2025-01-18 00:54:49,456 ----------------------------------------------------------------------------------------------------
2025-01-18 00:54:49,456 EPOCH 16 done: loss 0.0000 - lr: 0.100000
2025-01-18 00:54:49,580 DEV : loss 3.984988779848209e-06 - f1-score (micro avg)  0.0
2025-01-18 00:54:49,580  - 0 epochs without improvement
2025-01-18 00:54:49,580 ----------------------------------------------------------------------------------------------------
2025-01-18 00:54:49,670 epoch 17 - iter 1/1 - loss 0.00000606 - time (sec): 0.09 - samples/sec: 81.77 - lr: 0.100000 - momentum: 0.000000
2025-01-18 00:54:49,671 ----------------------------------------------------------------------------------------------------
2025-01-18 00:54:49,671 EPOCH 17 done: loss 0.0000 - lr: 0.100000
2025-01-18 00:54:49,795 DEV : loss 3.831720277958084e-06 - f1-score (micro avg)  0.0
2025-01-18 00:54:49,796  - 0 epochs without improvement
2025-01-18 00:54:49,796 ----------------------------------------------------------------------------------------------------
2025-01-18 00:54:49,886 epoch 18 - iter 1/1 - loss 0.00000903 - time (sec): 0.09 - samples/sec: 82.18 - lr: 0.100000 - momentum: 0.000000
2025-01-18 00:54:49,886 ----------------------------------------------------------------------------------------------------
2025-01-18 00:54:49,886 EPOCH 18 done: loss 0.0000 - lr: 0.100000
2025-01-18 00:54:50,010 DEV : loss 3.661421487777261e-06 - f1-score (micro avg)  0.0
2025-01-18 00:54:50,010  - 0 epochs without improvement
2025-01-18 00:54:50,010 ----------------------------------------------------------------------------------------------------
2025-01-18 00:54:50,100 epoch 19 - iter 1/1 - loss 0.00000783 - time (sec): 0.09 - samples/sec: 81.82 - lr: 0.100000 - momentum: 0.000000
2025-01-18 00:54:50,100 ----------------------------------------------------------------------------------------------------
2025-01-18 00:54:50,100 EPOCH 19 done: loss 0.0000 - lr: 0.100000
2025-01-18 00:54:50,227 DEV : loss 3.5081529858871363e-06 - f1-score (micro avg)  0.0
2025-01-18 00:54:50,227  - 0 epochs without improvement
2025-01-18 00:54:50,227 ----------------------------------------------------------------------------------------------------
2025-01-18 00:54:50,398 epoch 20 - iter 1/1 - loss 0.00000559 - time (sec): 0.17 - samples/sec: 42.23 - lr: 0.100000 - momentum: 0.000000
2025-01-18 00:54:50,398 ----------------------------------------------------------------------------------------------------
2025-01-18 00:54:50,398 EPOCH 20 done: loss 0.0000 - lr: 0.100000
2025-01-18 00:54:50,520 DEV : loss 3.3889439237100305e-06 - f1-score (micro avg)  0.0
2025-01-18 00:54:50,521  - 0 epochs without improvement
2025-01-18 00:54:50,521 ----------------------------------------------------------------------------------------------------
2025-01-18 00:54:50,611 epoch 21 - iter 1/1 - loss 0.00000496 - time (sec): 0.09 - samples/sec: 82.31 - lr: 0.100000 - momentum: 0.000000
2025-01-18 00:54:50,611 ----------------------------------------------------------------------------------------------------
2025-01-18 00:54:50,611 EPOCH 21 done: loss 0.0000 - lr: 0.100000
2025-01-18 00:54:50,735 DEV : loss 3.2867651498236228e-06 - f1-score (micro avg)  0.0
2025-01-18 00:54:50,735  - 0 epochs without improvement
2025-01-18 00:54:50,735 ----------------------------------------------------------------------------------------------------
2025-01-18 00:54:50,825 epoch 22 - iter 1/1 - loss 0.00000649 - time (sec): 0.09 - samples/sec: 82.04 - lr: 0.100000 - momentum: 0.000000
2025-01-18 00:54:50,825 ----------------------------------------------------------------------------------------------------
2025-01-18 00:54:50,825 EPOCH 22 done: loss 0.0000 - lr: 0.100000
2025-01-18 00:54:50,949 DEV : loss 3.1675563150201924e-06 - f1-score (micro avg)  0.0
2025-01-18 00:54:50,950  - 0 epochs without improvement
2025-01-18 00:54:50,950 ----------------------------------------------------------------------------------------------------
2025-01-18 00:54:51,041 epoch 23 - iter 1/1 - loss 0.00000325 - time (sec): 0.09 - samples/sec: 81.27 - lr: 0.100000 - momentum: 0.000000
2025-01-18 00:54:51,041 ----------------------------------------------------------------------------------------------------
2025-01-18 00:54:51,041 EPOCH 23 done: loss 0.0000 - lr: 0.100000
2025-01-18 00:54:51,164 DEV : loss 3.082406919929781e-06 - f1-score (micro avg)  0.0
2025-01-18 00:54:51,164  - 0 epochs without improvement
2025-01-18 00:54:51,164 ----------------------------------------------------------------------------------------------------
2025-01-18 00:54:51,253 epoch 24 - iter 1/1 - loss 0.00000734 - time (sec): 0.08 - samples/sec: 83.51 - lr: 0.100000 - momentum: 0.000000
2025-01-18 00:54:51,253 ----------------------------------------------------------------------------------------------------
2025-01-18 00:54:51,253 EPOCH 24 done: loss 0.0000 - lr: 0.100000
2025-01-18 00:54:51,377 DEV : loss 2.946168478956679e-06 - f1-score (micro avg)  0.0
2025-01-18 00:54:51,377  - 0 epochs without improvement
2025-01-18 00:54:51,377 ----------------------------------------------------------------------------------------------------
2025-01-18 00:54:51,467 epoch 25 - iter 1/1 - loss 0.00000613 - time (sec): 0.09 - samples/sec: 82.33 - lr: 0.100000 - momentum: 0.000000
2025-01-18 00:54:51,467 ----------------------------------------------------------------------------------------------------
2025-01-18 00:54:51,467 EPOCH 25 done: loss 0.0000 - lr: 0.100000
2025-01-18 00:54:51,591 DEV : loss 2.843989022949245e-06 - f1-score (micro avg)  0.0
2025-01-18 00:54:51,591  - 0 epochs without improvement
2025-01-18 00:54:51,591 ----------------------------------------------------------------------------------------------------
2025-01-18 00:54:51,681 epoch 26 - iter 1/1 - loss 0.00000462 - time (sec): 0.08 - samples/sec: 82.82 - lr: 0.100000 - momentum: 0.000000
2025-01-18 00:54:51,681 ----------------------------------------------------------------------------------------------------
2025-01-18 00:54:51,681 EPOCH 26 done: loss 0.0000 - lr: 0.100000
2025-01-18 00:54:51,805 DEV : loss 2.7758699161495315e-06 - f1-score (micro avg)  0.0
2025-01-18 00:54:51,805  - 0 epochs without improvement
2025-01-18 00:54:51,805 ----------------------------------------------------------------------------------------------------
2025-01-18 00:54:51,894 epoch 27 - iter 1/1 - loss 0.00000552 - time (sec): 0.08 - samples/sec: 83.03 - lr: 0.100000 - momentum: 0.000000
2025-01-18 00:54:51,895 ----------------------------------------------------------------------------------------------------
2025-01-18 00:54:51,895 EPOCH 27 done: loss 0.0000 - lr: 0.100000
2025-01-18 00:54:52,016 DEV : loss 2.69072052105912e-06 - f1-score (micro avg)  0.0
2025-01-18 00:54:52,017  - 0 epochs without improvement
2025-01-18 00:54:52,017 ----------------------------------------------------------------------------------------------------
2025-01-18 00:54:52,106 epoch 28 - iter 1/1 - loss 0.00000407 - time (sec): 0.08 - samples/sec: 82.45 - lr: 0.100000 - momentum: 0.000000
2025-01-18 00:54:52,106 ----------------------------------------------------------------------------------------------------
2025-01-18 00:54:52,107 EPOCH 28 done: loss 0.0000 - lr: 0.100000
2025-01-18 00:54:52,230 DEV : loss 2.6055711259687087e-06 - f1-score (micro avg)  0.0
2025-01-18 00:54:52,230  - 0 epochs without improvement
2025-01-18 00:54:52,230 ----------------------------------------------------------------------------------------------------
2025-01-18 00:54:52,320 epoch 29 - iter 1/1 - loss 0.00000557 - time (sec): 0.08 - samples/sec: 82.45 - lr: 0.100000 - momentum: 0.000000
2025-01-18 00:54:52,320 ----------------------------------------------------------------------------------------------------
2025-01-18 00:54:52,320 EPOCH 29 done: loss 0.0000 - lr: 0.100000
2025-01-18 00:54:52,442 DEV : loss 2.5374515644216444e-06 - f1-score (micro avg)  0.0
2025-01-18 00:54:52,443  - 0 epochs without improvement
2025-01-18 00:54:52,443 ----------------------------------------------------------------------------------------------------
2025-01-18 00:54:52,534 epoch 30 - iter 1/1 - loss 0.00000630 - time (sec): 0.09 - samples/sec: 81.59 - lr: 0.100000 - momentum: 0.000000
2025-01-18 00:54:52,534 ----------------------------------------------------------------------------------------------------
2025-01-18 00:54:52,534 EPOCH 30 done: loss 0.0000 - lr: 0.100000
2025-01-18 00:54:52,658 DEV : loss 2.4352725631615613e-06 - f1-score (micro avg)  0.0
2025-01-18 00:54:52,658  - 0 epochs without improvement
2025-01-18 00:54:52,658 ----------------------------------------------------------------------------------------------------
2025-01-18 00:54:52,830 epoch 31 - iter 1/1 - loss 0.00000519 - time (sec): 0.17 - samples/sec: 41.97 - lr: 0.100000 - momentum: 0.000000
2025-01-18 00:54:52,830 ----------------------------------------------------------------------------------------------------
2025-01-18 00:54:52,830 EPOCH 31 done: loss 0.0000 - lr: 0.100000
2025-01-18 00:54:52,954 DEV : loss 2.3671527742408216e-06 - f1-score (micro avg)  0.0
2025-01-18 00:54:52,955  - 0 epochs without improvement
2025-01-18 00:54:52,955 ----------------------------------------------------------------------------------------------------
2025-01-18 00:54:53,045 epoch 32 - iter 1/1 - loss 0.00000496 - time (sec): 0.09 - samples/sec: 82.20 - lr: 0.100000 - momentum: 0.000000
2025-01-18 00:54:53,045 ----------------------------------------------------------------------------------------------------
2025-01-18 00:54:53,045 EPOCH 32 done: loss 0.0000 - lr: 0.100000
2025-01-18 00:54:53,168 DEV : loss 2.282003833897761e-06 - f1-score (micro avg)  0.0
2025-01-18 00:54:53,168  - 0 epochs without improvement
2025-01-18 00:54:53,168 ----------------------------------------------------------------------------------------------------
2025-01-18 00:54:53,257 epoch 33 - iter 1/1 - loss 0.00000560 - time (sec): 0.08 - samples/sec: 82.55 - lr: 0.100000 - momentum: 0.000000
2025-01-18 00:54:53,257 ----------------------------------------------------------------------------------------------------
2025-01-18 00:54:53,257 EPOCH 33 done: loss 0.0000 - lr: 0.100000
2025-01-18 00:54:53,383 DEV : loss 2.2138844997243723e-06 - f1-score (micro avg)  0.0
2025-01-18 00:54:53,384  - 0 epochs without improvement
2025-01-18 00:54:53,384 ----------------------------------------------------------------------------------------------------
2025-01-18 00:54:53,473 epoch 34 - iter 1/1 - loss 0.00000332 - time (sec): 0.08 - samples/sec: 82.71 - lr: 0.100000 - momentum: 0.000000
2025-01-18 00:54:53,473 ----------------------------------------------------------------------------------------------------
2025-01-18 00:54:53,473 EPOCH 34 done: loss 0.0000 - lr: 0.100000
2025-01-18 00:54:53,599 DEV : loss 2.1627947717206553e-06 - f1-score (micro avg)  0.0
2025-01-18 00:54:53,599  - 0 epochs without improvement
2025-01-18 00:54:53,600 ----------------------------------------------------------------------------------------------------
2025-01-18 00:54:53,689 epoch 35 - iter 1/1 - loss 0.00000402 - time (sec): 0.08 - samples/sec: 82.98 - lr: 0.100000 - momentum: 0.000000
2025-01-18 00:54:53,689 ----------------------------------------------------------------------------------------------------
2025-01-18 00:54:53,689 EPOCH 35 done: loss 0.0000 - lr: 0.100000
2025-01-18 00:54:53,811 DEV : loss 2.128735104633961e-06 - f1-score (micro avg)  0.0
2025-01-18 00:54:53,811  - 0 epochs without improvement
2025-01-18 00:54:53,811 ----------------------------------------------------------------------------------------------------
2025-01-18 00:54:53,901 epoch 36 - iter 1/1 - loss 0.00000291 - time (sec): 0.08 - samples/sec: 82.47 - lr: 0.100000 - momentum: 0.000000
2025-01-18 00:54:53,901 ----------------------------------------------------------------------------------------------------
2025-01-18 00:54:53,901 EPOCH 36 done: loss 0.0000 - lr: 0.100000
2025-01-18 00:54:54,024 DEV : loss 2.0776456040039193e-06 - f1-score (micro avg)  0.0
2025-01-18 00:54:54,024  - 0 epochs without improvement
2025-01-18 00:54:54,025 ----------------------------------------------------------------------------------------------------
2025-01-18 00:54:54,114 epoch 37 - iter 1/1 - loss 0.00000317 - time (sec): 0.08 - samples/sec: 82.48 - lr: 0.100000 - momentum: 0.000000
2025-01-18 00:54:54,114 ----------------------------------------------------------------------------------------------------
2025-01-18 00:54:54,114 EPOCH 37 done: loss 0.0000 - lr: 0.100000
2025-01-18 00:54:54,237 DEV : loss 2.0435861642909003e-06 - f1-score (micro avg)  0.0
2025-01-18 00:54:54,237  - 0 epochs without improvement
2025-01-18 00:54:54,237 ----------------------------------------------------------------------------------------------------
2025-01-18 00:54:54,327 epoch 38 - iter 1/1 - loss 0.00000388 - time (sec): 0.09 - samples/sec: 81.87 - lr: 0.100000 - momentum: 0.000000
2025-01-18 00:54:54,327 ----------------------------------------------------------------------------------------------------
2025-01-18 00:54:54,327 EPOCH 38 done: loss 0.0000 - lr: 0.100000
2025-01-18 00:54:54,453 DEV : loss 1.9924964362871833e-06 - f1-score (micro avg)  0.0
2025-01-18 00:54:54,453  - 0 epochs without improvement
2025-01-18 00:54:54,453 ----------------------------------------------------------------------------------------------------
2025-01-18 00:54:54,543 epoch 39 - iter 1/1 - loss 0.00000514 - time (sec): 0.08 - samples/sec: 82.42 - lr: 0.100000 - momentum: 0.000000
2025-01-18 00:54:54,543 ----------------------------------------------------------------------------------------------------
2025-01-18 00:54:54,543 EPOCH 39 done: loss 0.0000 - lr: 0.100000
2025-01-18 00:54:54,667 DEV : loss 1.924376874740119e-06 - f1-score (micro avg)  0.0
2025-01-18 00:54:54,668  - 0 epochs without improvement
2025-01-18 00:54:54,668 ----------------------------------------------------------------------------------------------------
2025-01-18 00:54:54,757 epoch 40 - iter 1/1 - loss 0.00000370 - time (sec): 0.08 - samples/sec: 82.77 - lr: 0.100000 - momentum: 0.000000
2025-01-18 00:54:54,757 ----------------------------------------------------------------------------------------------------
2025-01-18 00:54:54,757 EPOCH 40 done: loss 0.0000 - lr: 0.100000
2025-01-18 00:54:54,881 DEV : loss 1.8732872604232398e-06 - f1-score (micro avg)  0.0
2025-01-18 00:54:54,882  - 0 epochs without improvement
2025-01-18 00:54:54,882 ----------------------------------------------------------------------------------------------------
2025-01-18 00:54:54,971 epoch 41 - iter 1/1 - loss 0.00000364 - time (sec): 0.08 - samples/sec: 82.85 - lr: 0.100000 - momentum: 0.000000
2025-01-18 00:54:54,971 ----------------------------------------------------------------------------------------------------
2025-01-18 00:54:54,971 EPOCH 41 done: loss 0.0000 - lr: 0.100000
2025-01-18 00:54:55,094 DEV : loss 1.8392274796497077e-06 - f1-score (micro avg)  0.0
2025-01-18 00:54:55,094  - 0 epochs without improvement
2025-01-18 00:54:55,094 ----------------------------------------------------------------------------------------------------
2025-01-18 00:54:55,184 epoch 42 - iter 1/1 - loss 0.00000354 - time (sec): 0.09 - samples/sec: 82.18 - lr: 0.100000 - momentum: 0.000000
2025-01-18 00:54:55,184 ----------------------------------------------------------------------------------------------------
2025-01-18 00:54:55,184 EPOCH 42 done: loss 0.0000 - lr: 0.100000
2025-01-18 00:54:55,315 DEV : loss 1.8051675851893378e-06 - f1-score (micro avg)  0.0
2025-01-18 00:54:55,315  - 0 epochs without improvement
2025-01-18 00:54:55,315 ----------------------------------------------------------------------------------------------------
2025-01-18 00:54:55,487 epoch 43 - iter 1/1 - loss 0.00000371 - time (sec): 0.17 - samples/sec: 41.94 - lr: 0.100000 - momentum: 0.000000
2025-01-18 00:54:55,487 ----------------------------------------------------------------------------------------------------
2025-01-18 00:54:55,487 EPOCH 43 done: loss 0.0000 - lr: 0.100000
2025-01-18 00:54:55,612 DEV : loss 1.7540780845592963e-06 - f1-score (micro avg)  0.0
2025-01-18 00:54:55,612  - 0 epochs without improvement
2025-01-18 00:54:55,612 ----------------------------------------------------------------------------------------------------
2025-01-18 00:54:55,702 epoch 44 - iter 1/1 - loss 0.00000543 - time (sec): 0.09 - samples/sec: 82.11 - lr: 0.100000 - momentum: 0.000000
2025-01-18 00:54:55,702 ----------------------------------------------------------------------------------------------------
2025-01-18 00:54:55,702 EPOCH 44 done: loss 0.0000 - lr: 0.100000
2025-01-18 00:54:55,826 DEV : loss 1.7029883565555792e-06 - f1-score (micro avg)  0.0
2025-01-18 00:54:55,827  - 0 epochs without improvement
2025-01-18 00:54:55,827 ----------------------------------------------------------------------------------------------------
2025-01-18 00:54:55,916 epoch 45 - iter 1/1 - loss 0.00000538 - time (sec): 0.08 - samples/sec: 82.49 - lr: 0.100000 - momentum: 0.000000
2025-01-18 00:54:55,917 ----------------------------------------------------------------------------------------------------
2025-01-18 00:54:55,917 EPOCH 45 done: loss 0.0000 - lr: 0.100000
2025-01-18 00:54:56,040 DEV : loss 1.634868795008515e-06 - f1-score (micro avg)  0.0
2025-01-18 00:54:56,041  - 0 epochs without improvement
2025-01-18 00:54:56,041 ----------------------------------------------------------------------------------------------------
2025-01-18 00:54:56,130 epoch 46 - iter 1/1 - loss 0.00000295 - time (sec): 0.09 - samples/sec: 82.31 - lr: 0.100000 - momentum: 0.000000
2025-01-18 00:54:56,131 ----------------------------------------------------------------------------------------------------
2025-01-18 00:54:56,131 EPOCH 46 done: loss 0.0000 - lr: 0.100000
2025-01-18 00:54:56,256 DEV : loss 1.61783884777833e-06 - f1-score (micro avg)  0.0
2025-01-18 00:54:56,257  - 0 epochs without improvement
2025-01-18 00:54:56,257 ----------------------------------------------------------------------------------------------------
2025-01-18 00:54:56,348 epoch 47 - iter 1/1 - loss 0.00000378 - time (sec): 0.09 - samples/sec: 81.21 - lr: 0.100000 - momentum: 0.000000
2025-01-18 00:54:56,348 ----------------------------------------------------------------------------------------------------
2025-01-18 00:54:56,348 EPOCH 47 done: loss 0.0000 - lr: 0.100000
2025-01-18 00:54:56,473 DEV : loss 1.5837794080653111e-06 - f1-score (micro avg)  0.0
2025-01-18 00:54:56,474  - 0 epochs without improvement
2025-01-18 00:54:56,474 ----------------------------------------------------------------------------------------------------
2025-01-18 00:54:56,563 epoch 48 - iter 1/1 - loss 0.00000335 - time (sec): 0.08 - samples/sec: 82.72 - lr: 0.100000 - momentum: 0.000000
2025-01-18 00:54:56,563 ----------------------------------------------------------------------------------------------------
2025-01-18 00:54:56,563 EPOCH 48 done: loss 0.0000 - lr: 0.100000
2025-01-18 00:54:56,687 DEV : loss 1.566749574521964e-06 - f1-score (micro avg)  0.0
2025-01-18 00:54:56,687  - 0 epochs without improvement
2025-01-18 00:54:56,687 ----------------------------------------------------------------------------------------------------
2025-01-18 00:54:56,776 epoch 49 - iter 1/1 - loss 0.00000368 - time (sec): 0.08 - samples/sec: 82.66 - lr: 0.100000 - momentum: 0.000000
2025-01-18 00:54:56,776 ----------------------------------------------------------------------------------------------------
2025-01-18 00:54:56,776 EPOCH 49 done: loss 0.0000 - lr: 0.100000
2025-01-18 00:54:56,899 DEV : loss 1.4986301266617374e-06 - f1-score (micro avg)  0.0
2025-01-18 00:54:56,899  - 0 epochs without improvement
2025-01-18 00:54:56,899 ----------------------------------------------------------------------------------------------------
2025-01-18 00:54:56,989 epoch 50 - iter 1/1 - loss 0.00000327 - time (sec): 0.08 - samples/sec: 82.38 - lr: 0.100000 - momentum: 0.000000
2025-01-18 00:54:56,989 ----------------------------------------------------------------------------------------------------
2025-01-18 00:54:56,989 EPOCH 50 done: loss 0.0000 - lr: 0.100000
2025-01-18 00:54:57,114 DEV : loss 1.4645703458882053e-06 - f1-score (micro avg)  0.0
2025-01-18 00:54:57,114  - 0 epochs without improvement
2025-01-18 00:54:57,114 ----------------------------------------------------------------------------------------------------
2025-01-18 00:54:57,204 epoch 51 - iter 1/1 - loss 0.00000232 - time (sec): 0.09 - samples/sec: 82.29 - lr: 0.100000 - momentum: 0.000000
2025-01-18 00:54:57,204 ----------------------------------------------------------------------------------------------------
2025-01-18 00:54:57,204 EPOCH 51 done: loss 0.0000 - lr: 0.100000
2025-01-18 00:54:57,327 DEV : loss 1.4645703458882053e-06 - f1-score (micro avg)  0.0
2025-01-18 00:54:57,327  - 1 epochs without improvement
2025-01-18 00:54:57,327 ----------------------------------------------------------------------------------------------------
2025-01-18 00:54:57,416 epoch 52 - iter 1/1 - loss 0.00000266 - time (sec): 0.08 - samples/sec: 82.99 - lr: 0.100000 - momentum: 0.000000
2025-01-18 00:54:57,416 ----------------------------------------------------------------------------------------------------
2025-01-18 00:54:57,417 EPOCH 52 done: loss 0.0000 - lr: 0.100000
2025-01-18 00:54:57,542 DEV : loss 1.4475403986580204e-06 - f1-score (micro avg)  0.0
2025-01-18 00:54:57,542  - 0 epochs without improvement
2025-01-18 00:54:57,542 ----------------------------------------------------------------------------------------------------
2025-01-18 00:54:57,631 epoch 53 - iter 1/1 - loss 0.00000412 - time (sec): 0.08 - samples/sec: 83.09 - lr: 0.100000 - momentum: 0.000000
2025-01-18 00:54:57,631 ----------------------------------------------------------------------------------------------------
2025-01-18 00:54:57,631 EPOCH 53 done: loss 0.0000 - lr: 0.100000
2025-01-18 00:54:57,754 DEV : loss 1.379420950797794e-06 - f1-score (micro avg)  0.0
2025-01-18 00:54:57,754  - 0 epochs without improvement
2025-01-18 00:54:57,754 ----------------------------------------------------------------------------------------------------
2025-01-18 00:54:57,843 epoch 54 - iter 1/1 - loss 0.00000271 - time (sec): 0.08 - samples/sec: 82.59 - lr: 0.100000 - momentum: 0.000000
2025-01-18 00:54:57,844 ----------------------------------------------------------------------------------------------------
2025-01-18 00:54:57,844 EPOCH 54 done: loss 0.0000 - lr: 0.100000
2025-01-18 00:54:57,967 DEV : loss 1.362391003567609e-06 - f1-score (micro avg)  0.0
2025-01-18 00:54:57,967  - 0 epochs without improvement
2025-01-18 00:54:57,967 ----------------------------------------------------------------------------------------------------
2025-01-18 00:54:58,139 epoch 55 - iter 1/1 - loss 0.00000412 - time (sec): 0.17 - samples/sec: 41.84 - lr: 0.100000 - momentum: 0.000000
2025-01-18 00:54:58,139 ----------------------------------------------------------------------------------------------------
2025-01-18 00:54:58,139 EPOCH 55 done: loss 0.0000 - lr: 0.100000
2025-01-18 00:54:58,264 DEV : loss 1.3453611700242618e-06 - f1-score (micro avg)  0.0
2025-01-18 00:54:58,265  - 0 epochs without improvement
2025-01-18 00:54:58,265 ----------------------------------------------------------------------------------------------------
2025-01-18 00:54:58,355 epoch 56 - iter 1/1 - loss 0.00000266 - time (sec): 0.09 - samples/sec: 82.13 - lr: 0.100000 - momentum: 0.000000
2025-01-18 00:54:58,355 ----------------------------------------------------------------------------------------------------
2025-01-18 00:54:58,355 EPOCH 56 done: loss 0.0000 - lr: 0.100000
2025-01-18 00:54:58,483 DEV : loss 1.3283312227940769e-06 - f1-score (micro avg)  0.0
2025-01-18 00:54:58,483  - 0 epochs without improvement
2025-01-18 00:54:58,483 ----------------------------------------------------------------------------------------------------
2025-01-18 00:54:58,573 epoch 57 - iter 1/1 - loss 0.00000310 - time (sec): 0.09 - samples/sec: 82.15 - lr: 0.100000 - momentum: 0.000000
2025-01-18 00:54:58,573 ----------------------------------------------------------------------------------------------------
2025-01-18 00:54:58,573 EPOCH 57 done: loss 0.0000 - lr: 0.100000
2025-01-18 00:54:58,698 DEV : loss 1.2602117749338504e-06 - f1-score (micro avg)  0.0
2025-01-18 00:54:58,698  - 0 epochs without improvement
2025-01-18 00:54:58,698 ----------------------------------------------------------------------------------------------------
2025-01-18 00:54:58,787 epoch 58 - iter 1/1 - loss 0.00000247 - time (sec): 0.08 - samples/sec: 82.77 - lr: 0.100000 - momentum: 0.000000
2025-01-18 00:54:58,787 ----------------------------------------------------------------------------------------------------
2025-01-18 00:54:58,787 EPOCH 58 done: loss 0.0000 - lr: 0.100000
2025-01-18 00:54:58,910 DEV : loss 1.2602117749338504e-06 - f1-score (micro avg)  0.0
2025-01-18 00:54:58,910  - 1 epochs without improvement
2025-01-18 00:54:58,910 ----------------------------------------------------------------------------------------------------
2025-01-18 00:54:59,000 epoch 59 - iter 1/1 - loss 0.00000240 - time (sec): 0.09 - samples/sec: 82.15 - lr: 0.100000 - momentum: 0.000000
2025-01-18 00:54:59,000 ----------------------------------------------------------------------------------------------------
2025-01-18 00:54:59,000 EPOCH 59 done: loss 0.0000 - lr: 0.100000
2025-01-18 00:54:59,126 DEV : loss 1.2431818277036655e-06 - f1-score (micro avg)  0.0
2025-01-18 00:54:59,127  - 0 epochs without improvement
2025-01-18 00:54:59,127 ----------------------------------------------------------------------------------------------------
2025-01-18 00:54:59,216 epoch 60 - iter 1/1 - loss 0.00000250 - time (sec): 0.08 - samples/sec: 82.50 - lr: 0.100000 - momentum: 0.000000
2025-01-18 00:54:59,216 ----------------------------------------------------------------------------------------------------
2025-01-18 00:54:59,216 EPOCH 60 done: loss 0.0000 - lr: 0.100000
2025-01-18 00:54:59,340 DEV : loss 1.2261519941603183e-06 - f1-score (micro avg)  0.0
2025-01-18 00:54:59,340  - 0 epochs without improvement
2025-01-18 00:54:59,340 ----------------------------------------------------------------------------------------------------
2025-01-18 00:54:59,431 epoch 61 - iter 1/1 - loss 0.00000186 - time (sec): 0.09 - samples/sec: 81.56 - lr: 0.100000 - momentum: 0.000000
2025-01-18 00:54:59,431 ----------------------------------------------------------------------------------------------------
2025-01-18 00:54:59,431 EPOCH 61 done: loss 0.0000 - lr: 0.100000
2025-01-18 00:54:59,554 DEV : loss 1.2261519941603183e-06 - f1-score (micro avg)  0.0
2025-01-18 00:54:59,554  - 1 epochs without improvement
2025-01-18 00:54:59,554 ----------------------------------------------------------------------------------------------------
2025-01-18 00:54:59,645 epoch 62 - iter 1/1 - loss 0.00000269 - time (sec): 0.09 - samples/sec: 81.85 - lr: 0.100000 - momentum: 0.000000
2025-01-18 00:54:59,645 ----------------------------------------------------------------------------------------------------
2025-01-18 00:54:59,645 EPOCH 62 done: loss 0.0000 - lr: 0.100000
2025-01-18 00:54:59,770 DEV : loss 1.2091220469301334e-06 - f1-score (micro avg)  0.0
2025-01-18 00:54:59,771  - 0 epochs without improvement
2025-01-18 00:54:59,771 ----------------------------------------------------------------------------------------------------
2025-01-18 00:54:59,861 epoch 63 - iter 1/1 - loss 0.00000305 - time (sec): 0.09 - samples/sec: 81.26 - lr: 0.100000 - momentum: 0.000000
2025-01-18 00:54:59,862 ----------------------------------------------------------------------------------------------------
2025-01-18 00:54:59,862 EPOCH 63 done: loss 0.0000 - lr: 0.100000
2025-01-18 00:54:59,987 DEV : loss 1.1410025990699069e-06 - f1-score (micro avg)  0.0
2025-01-18 00:54:59,987  - 0 epochs without improvement
2025-01-18 00:54:59,987 ----------------------------------------------------------------------------------------------------
2025-01-18 00:55:00,077 epoch 64 - iter 1/1 - loss 0.00000252 - time (sec): 0.08 - samples/sec: 82.84 - lr: 0.100000 - momentum: 0.000000
2025-01-18 00:55:00,077 ----------------------------------------------------------------------------------------------------
2025-01-18 00:55:00,077 EPOCH 64 done: loss 0.0000 - lr: 0.100000
2025-01-18 00:55:00,202 DEV : loss 1.1410025990699069e-06 - f1-score (micro avg)  0.0
2025-01-18 00:55:00,202  - 1 epochs without improvement
2025-01-18 00:55:00,774 ----------------------------------------------------------------------------------------------------
2025-01-18 00:55:00,775 Testing using last state of model ...
2025-01-18 00:55:00,818 
Results:
- F-score (micro) 0.0
- F-score (macro) 0.0
- Accuracy 0.0

By class:
                              precision    recall  f1-score   support

__label__Geologia_i_Geodezja     0.0000    0.0000    0.0000        33
    __label__Nauki_społeczne     0.0000    0.0000    0.0000        31
             __label__Chemia     0.0000    0.0000    0.0000        28
             __label__Fizyka     0.0000    0.0000    0.0000        21
         __label__Matematyka     0.0000    0.0000    0.0000        21
        __label__Informatyka     0.0000    0.0000    0.0000         6
       __label__Fotowoltaika     0.0000    0.0000    0.0000         3

                   micro avg     0.0000    0.0000    0.0000       143
                   macro avg     0.0000    0.0000    0.0000       143
                weighted avg     0.0000    0.0000    0.0000       143
                 samples avg     0.0000    0.0000    0.0000       143

2025-01-18 00:55:00,818 ----------------------------------------------------------------------------------------------------
